{
  "messageId": "11111111-1111-4111-8111-111111111111",
  "jobId": "11111111-1111-4111-8111-111111111111",
  "runId": "11111111-1111-4111-8111-111111111111",
  "projectId": "11111111-1111-4111-8111-111111111111",
  "correlationId": "11111111-1111-4111-8111-111111111111",
  "inputManifestId": "11111111-1111-4111-8111-111111111111",
  "schemaVersion": 1,
  "stage": "PREVIEW",
  "policyVersion": 1,
  "createdAt": "2026-09-16T12:00:00Z",
  "deadlineAt": "2026-09-16T12:30:00Z",
  "expectedProjectGeneration": 1
}
